{
  "name": "MyResource",
  "definition": "example-value",
  "roleArn": "arn:aws:service:us-east-1:123456789012:resource/example",
  "type": "example-value",
  "loggingConfiguration": "example-value",
  "tags": "example-value",
  "tracingConfiguration": "example-value",
  "publish": "example-value",
  "versionDescription": "example-value"
}